{
  "$schema": "https://json-schema.org/draft/2020-12/schema",
  "$id": "urn:steelmatter:proposed:observation:1",
  "title": "observation proposed unsigned payload",
  "type": "object",
  "properties": {
    "schema_version": {
      "const": "1"
    },
    "crypto_profile": {
      "const": "SM-JWS-ES256-1"
    },
    "observation_id": {
      "type": "string",
      "minLength": 1,
      "maxLength": 128,
      "pattern": "^[A-Za-z0-9][A-Za-z0-9._:-]*$"
    },
    "observer_id": {
      "type": "string",
      "minLength": 1,
      "maxLength": 128,
      "pattern": "^[A-Za-z0-9][A-Za-z0-9._:-]*$"
    },
    "operation_id": {
      "type": "string",
      "minLength": 1,
      "maxLength": 128,
      "pattern": "^[A-Za-z0-9][A-Za-z0-9._:-]*$"
    },
    "tenant_id": {
      "type": "string",
      "minLength": 1,
      "maxLength": 128,
      "pattern": "^[A-Za-z0-9][A-Za-z0-9._:-]*$"
    },
    "instruction_id": {
      "type": "string",
      "minLength": 1,
      "maxLength": 128,
      "pattern": "^[A-Za-z0-9][A-Za-z0-9._:-]*$"
    },
    "execution_digest": {
      "type": "string",
      "pattern": "^[a-f0-9]{64}$"
    },
    "expected_action_digest": {
      "type": "string",
      "pattern": "^[a-f0-9]{64}$"
    },
    "observed_action_digest": {
      "anyOf": [
        {
          "type": "string",
          "pattern": "^[a-f0-9]{64}$"
        },
        {
          "type": "null"
        }
      ]
    },
    "target_order_id": {
      "type": "string",
      "minLength": 1,
      "maxLength": 128,
      "pattern": "^[A-Za-z0-9][A-Za-z0-9._:-]*$"
    },
    "status": {
      "enum": [
        "MATCH",
        "MISMATCH",
        "INSUFFICIENT_EVIDENCE"
      ]
    },
    "observed_at": {
      "type": "string",
      "format": "date-time",
      "pattern": "^\\d{4}-\\d{2}-\\d{2}T\\d{2}:\\d{2}:\\d{2}Z$"
    }
  },
  "required": [
    "schema_version",
    "crypto_profile",
    "observation_id",
    "observer_id",
    "operation_id",
    "tenant_id",
    "instruction_id",
    "execution_digest",
    "expected_action_digest",
    "observed_action_digest",
    "target_order_id",
    "status",
    "observed_at"
  ],
  "additionalProperties": false
}
